{
  "rule_id": "PS51-R008",
  "rule_version": "V01",
  "language": "POWERSHELL",
  "target_runtime": "WINDOWS_POWERSHELL_DESKTOP_5_1",
  "defect_family_id": "GENERIC_LIST_BINDING",
  "title": "Generic list binding defect",
  "description": "Generic list values can bind differently than expected across PowerShell 5.1 call boundaries.",
  "bad_pattern": {
    "type": "contract_test",
    "pattern": "generic_list_binding"
  },
  "approved_pattern": {
    "guidance": "Normalize to an explicitly supported collection shape at interface boundaries."
  },
  "detection_method": {
    "type": "contract_test",
    "pattern": "generic_list_binding"
  },
  "severity": "MEDIUM",
  "build_blocking": true,
  "positive_fixture": "fixtures/powershell/positive/PS51_POSITIVE_FIXTURES_V01.json#PS51-R008",
  "negative_fixture": "fixtures/powershell/negative/PS51_NEGATIVE_FIXTURES_V01.json#PS51-R008",
  "static_detector": "validators/powershell/static/ECTOS_PS51_STATIC_DETECTOR_CONTRACT_V01.json",
  "native_runtime_check": "validators/powershell/native/ECTOS_PS51_NATIVE_VALIDATION_CONTRACT_V01.json",
  "regression_required": true,
  "historical_source": {
    "source": "engineering/phase01/regression/regression-corpus-v01.json",
    "evidence_id": "REG-GENERIC-LIST"
  },
  "currentness": "CURRENT",
  "status": "ACTIVE"
}
