{
  "rule_id": "PS51-R006",
  "rule_version": "V01",
  "language": "POWERSHELL",
  "target_runtime": "WINDOWS_POWERSHELL_DESKTOP_5_1",
  "defect_family_id": "AUTOMATIC_VARIABLE_COLLISION",
  "title": "Automatic/reserved variable collision",
  "description": "User-defined parameters or variables can collide with PowerShell automatic/reserved variables.",
  "bad_pattern": {
    "type": "ast_contract",
    "pattern": "declared_symbol_matches_automatic_variable"
  },
  "approved_pattern": {
    "guidance": "Rename user-defined symbols to non-reserved names and validate with AST/static analysis."
  },
  "detection_method": {
    "type": "ast_contract",
    "pattern": "declared_symbol_matches_automatic_variable"
  },
  "severity": "HIGH",
  "build_blocking": true,
  "positive_fixture": "fixtures/powershell/positive/PS51_POSITIVE_FIXTURES_V01.json#PS51-R006",
  "negative_fixture": "fixtures/powershell/negative/PS51_NEGATIVE_FIXTURES_V01.json#PS51-R006",
  "static_detector": "validators/powershell/static/ECTOS_PS51_STATIC_DETECTOR_CONTRACT_V01.json",
  "native_runtime_check": "validators/powershell/native/ECTOS_PS51_NATIVE_VALIDATION_CONTRACT_V01.json",
  "regression_required": true,
  "historical_source": {
    "source": "engineering/phase01/regression/regression-corpus-v01.json",
    "evidence_id": "REG-AUTOVAR"
  },
  "currentness": "CURRENT",
  "status": "ACTIVE"
}
