{
  "rule_id": "PS51-R007",
  "rule_version": "V01",
  "language": "POWERSHELL",
  "target_runtime": "WINDOWS_POWERSHELL_DESKTOP_5_1",
  "defect_family_id": "EMPTY_COLLECTION_BINDING",
  "title": "Empty collection binding defect",
  "description": "Pipeline or parameter binding can collapse, unwrap, or mis-handle empty collections.",
  "bad_pattern": {
    "type": "contract_test",
    "pattern": "empty_collection_binding"
  },
  "approved_pattern": {
    "guidance": "Normalize collection inputs explicitly and test null, empty, single, and many cardinalities."
  },
  "detection_method": {
    "type": "contract_test",
    "pattern": "empty_collection_binding"
  },
  "severity": "HIGH",
  "build_blocking": true,
  "positive_fixture": "fixtures/powershell/positive/PS51_POSITIVE_FIXTURES_V01.json#PS51-R007",
  "negative_fixture": "fixtures/powershell/negative/PS51_NEGATIVE_FIXTURES_V01.json#PS51-R007",
  "static_detector": "validators/powershell/static/ECTOS_PS51_STATIC_DETECTOR_CONTRACT_V01.json",
  "native_runtime_check": "validators/powershell/native/ECTOS_PS51_NATIVE_VALIDATION_CONTRACT_V01.json",
  "regression_required": true,
  "historical_source": {
    "source": "engineering/phase01/regression/regression-corpus-v01.json",
    "evidence_id": "REG-EMPTY-COLLECTION"
  },
  "currentness": "CURRENT",
  "status": "ACTIVE"
}
